{
  "taskId": "2026-06-18-branch-hygiene-slash-path-fix",
  "repo": "pantheon-base",
  "agent": {
    "tool": "codex",
    "adapter": ".agents/adapters/codex.md"
  },
  "commands": [
    {
      "command": "npm run test:branch-hygiene",
      "cwd": "pantheon-base",
      "status": "passed",
      "durationMs": 0,
      "notes": "Re-runs the dedicated branch-hygiene regression suite after preserving slash-separated branch paths for the GitHub branch lookup and delete endpoints."
    }
  ],
  "graphChecks": {
    "usedCodeGraph": false,
    "affectedSubgraph": [
      "push|schedule|workflow_dispatch -> branch-hygiene workflow -> cleanup script -> GitHub branch lookup/delete endpoints"
    ],
    "checks": [
      "call-depth",
      "sensitive-flow"
    ],
    "findings": [],
    "notes": "This follow-up stays inside repository-governance logic and only changes how slash-containing branch names are routed into the hosted GitHub REST path."
  },
  "browserEvidence": [],
  "runtimeSensitive": true,
  "runtimeLogs": [],
  "runtimeGap": "Hosted GitHub workflow execution still needs a post-merge residue-branch rerun to prove live cleanup with slash-separated branch names.",
  "linkage": {
    "taskPacket": "docs/harness/tasks/2026-06-18-branch-hygiene-slash-path-fix.task.md",
    "evidenceDir": ".harness/evidence/2026-06-18-branch-hygiene-slash-path-fix/",
    "reviewFile": ".harness/evidence/2026-06-18-branch-hygiene-slash-path-fix/review.md",
    "changeRef": "none",
    "planRefs": []
  },
  "knownGaps": [
    "This evidence only proves the local regression suite and not the real GitHub hosted workflow run.",
    "Final closure still depends on a post-merge residue branch being deleted by the hosted workflow."
  ],
  "completedAt": "2026-06-18T05:10:00Z"
}
